"CAS","odor_goodscents"
"66-25-1","fresh green fatty aldehydic grass leafy fruity sweaty, green, fatty, leafy, vegetative, fruity and clean with a woody nuance"
"93-92-5","green leafy gardenia rhubarb musty"
"93-16-3","spicy clove blossom carnation woody"
"17511-60-3","fruity herbal woody jasmin oily basil"
"102-19-2","sweet honey cocoa balsam chocolate castoreum animal, sweet, honey, chocolate with a rosy floral nuance"
"546-49-6","herbal honey mint berry"
"98-55-5","pine terpene lilac citrus woody floral"
"80-26-2","herbal bergamot lavender lime citrus"
"62395-45-3","herbal green old wood citrus geranium tropical"
"80-27-3","herbal green old wood citrus geranium tropical"
"3452-97-9","grassy green weedy floral earthy aldehydic hay straw leaf, green, floral, herbal, cooling, camphoreous, woody, melon and berry"
"166432-52-6","green violet leaf floral violet greasy tropical fruity chicken coup"
"1632-73-1","camphor borneol pine woody dry sweet lemon"
"13877-93-5","sweet woody spice clove dry, spicy, woody and terpenic"
"464-45-9","pine woody camphor"
"4265-16-1","bitter almond"
"119-53-9","balsamic vanilla medicinal camphoreous"
"126-91-0","fresh floral woody natural deep lavender"
"150-60-7","smoky burnt earthy green caramel"
"539-30-0","powerful fruity pineapple tropical"
"121-33-5","sweet vanilla creamy chocolate"
"5454-21-7","mild fruity apricot herbal sage"
"7492-37-7","fruity berry dried fruit herbal aldehydic minty plum raisin fig woody, fruity, berry, woody with a herbal and minty nuance"
"614-47-1","floral balsam herbal"
"7492-39-9","mild sweet green fruity"
"589-35-5","fusel cognac wine cocoa green fruity, pungent, fusel, cognac and wine, cocoa, with green fruity undernotes"
"37526-88-8","balsamic earthy mushroom vegetable plastic cortex almond nutty, sweet, balsamic with a cherry / almond nuance"
"698-87-3","weak rose"
"89-88-3","sweet balsam woody root sandalwood"
"68129-81-7","sweet balsam woody root sandalwood"
"7492-69-5","warm herbal fruity spicy"
"127-41-3","sweet woody floral violet orris tropical fruity"
"127-42-4","sweet floral fruity powdery violet orris woody, sweet, powdery, woody, fruity, floral, ionone-like with tea nuances"
"614-29-9","floral orris"
"622-78-6","mild watercress dusty medicinal horseradish oily"
"93-04-9","sweet naphthyl floral orange blossom acacia neroli"
"13679-86-2","green minty spice herbal rosemary phenolic, green, cooling spice, herbaceous, with a terpy and minty nuance"
"112-05-0","waxy dirty cheese cultured dairy, waxy, dirty and cheesy with a cultured dairy nuance"
"150-84-5","floral green rose fruity citrus woody tropical fruit"
"22047-25-2","popcorn nutty corn chip bread crust chocolate hazelnut coffee, musty, roasted, corn chip, popcorn, nutty and potato-like"
"1122-62-9","popcorn heavy corn chip fatty tobacco, corn-like with a musty nutty nuance"
"350-03-8","sweet nutty dry hawthorn phenolic woody popcorn"
"68039-39-4","green weedy oily sweet woody floral gardenia jasmin tuberose"
"706-14-9","fresh oily waxy peach coconut buttery sweet, fruity, peach, creamy and sweet with a fatty nuance"
"88-84-6","sweet woody dry guaiacwood spicy powdery"
"539-90-2","sweet fruity pineapple tutti frutti rum cherry apple overripe fruit bubble gum, sweet, fruity, candy, berry, cherry, tutti frutti, over ripe and bubble gum-like"
"122-69-0","sweet balsam floral cassia cinnamyl, mild, floral, balsamic, sweet, floral, jasmin and rose, with a cinnamon spicy nuance"
"40918-97-6","sweet balsam floral cassia cinnamyl, mild, floral, balsamic, sweet, floral, jasmin and rose, with a cinnamon spicy nuance"
"92-52-4","pungent rose green geranium"
"106-33-2","sweet waxy floral soapy clean"
"495-62-5","balsamic citrus myrrh opoponax spicy, woody, citrus, valencene, fruity, tropical, terpy, green and banana"
"69104-96-7","herbal lavender woody green blueberry tomato"
"35158-25-9","herbal lavender woody green blueberry tomato"
"15352-77-9","citrus floral tangy lemon fresh sweet herbal"
"28588-76-3","sulfury meaty"
"22418-66-2","petitgrain bergamot citrus fresh green woody"
"7493-78-9","floral jasmin chocolate leather fruity balsam spicy cinnamyl, sweet, spicy, fruity and cinnamic with fatty, tropical nuances"
"2050-08-0","herbal floral clover azalea green sweet chocolate"
"122-99-6","mild rose balsam cinnamyl"
"104-57-4","floral fruity spicy almond cranberry black tea, chemical with a cherry fruity almond nuance"
"26927-89-9","balsam pine herbal"
"99-91-2","sweet mild acetophenone hay"
"13109-70-1","herbal woody"
"10519-11-6","woody floral fruity herbal dusty"
"24717-86-0","camphor nutty pine needle"
"103-50-4","sweet fruity cherry earthy mushroom rose plastic"
"56836-93-2","floral muguet green rose mentholic"
"94-47-3","soft rose balsam honey floral"
"7492-41-3","green earthy herbal balsam pine, balsamic"
"122-70-3","floral red rose fruity honey balsam styrax"
"765-70-8","sweet caramel maple sugar coffee woody, caramellic, maple, sweet, burnt, coffee, bready nuances"
"13494-06-9","sweet maple caramel sugar fenugreek licorice"
"13494-07-0","caramellic burnt sugar brown maple toffee molasses whiskey nutty coffee, sweet, brown, sugary, maple, cyclotene-like, caramellic"
"2445-83-2","sweet coumarin tonka coconut powdery"
"92-48-8","coconut creamy powdery coumarinic tonka cinnamyl vanilla floral earthy, sweet coconut, vanilla, creamy with a powdery floral nuance"
"77-93-0","odorless to mild fruity wine"
"94022-06-7","cypress oil"
"5240-32-4","natural acorn dry oak leaves hay woody immortelle herbal"
"7779-73-9","woody dry valerian root pine camphoreous oily balsamic forest, woody, mild, cooling and borneol-like with oily and green nuances"
"68213-87-6","strong sweet clean waxy aldehydic ozone rose"
"55418-52-5","sweet raspberry heliotrope powdery cotton candy, sweet, powdery, floral, berry and fruity with a jammy nuance"
"22451-73-6","spicy"
"90-42-6","cyclamen sweet herbal cumin mint woody orris ozone"
"57197-03-2","mild rose"
"22810-10-2","fresh clean rose citrus green citronellyl acetate"
"14667-55-1","nutty nut skin earthy powdery cocoa baked potato roasted peanut hazelnut musty, nutty, musty, powdery cocoa, potato and musty"
"78-92-2","sweet apricot"
"84642-61-5","fruity cheese acetic creamy dried berry butter, creamy, musty and buttery"
"591-60-6","sweet fruity brandy fermented"
"7779-75-1","sweet wine brandy fruity"
"99-93-4","mild sweet hawthorn balsam mimosa"
"118-93-4","phenolic sweet hawthorn tobacco honey herbal, phenolic, sharp, benzaldehyde, cherry pit, tropical, melon with a tobacco afternote"
"136-60-7","mild amber balsam fruity"
"25409-08-9","cooked roasted"
"87745-65-1","cooked roasted"
"7492-44-6","floral green jasmin lily herbal"
"538-65-8","sweet balsam cocoa spicy fruity"
"52392-64-0","sweet balsam cocoa spicy fruity"
"88-60-8","russian leather"
"10519-06-9","powerful ylang floral"
"619-01-2","minty menthol spearmint herbal, minty cooling sweet camphoreous, with fresh terpy nuances"
"20691-52-5","floral woody"
"140-67-0","sweet sassafrass anise spice green herbal fennel, sweet, phenolic, anise, harsh, spice, green, herbal, minty"
"98-52-2","woody musty patchouli camphor mint leather"
"120-50-3","sweet fruity musty powdery balsam"
"1728-46-7","powerful woody camphor orris minty"
"6789-88-4","fresh balsam sappy clean woody"
"7492-45-7","fatty oily green dairy nasturtium clean citrus"
"2679-87-0","berry floral woody"
"713-95-1","fresh sweet metallic peach oily coconut buttery, fatty, sweet, creamy, dairy, fruity, peach, apricot, milky and buttery"
"2305-05-7","fatty peach sweet metallic fruity"
"592-84-7","fruity plum rum brandy"
"98-00-0","alcoholic chemical musty sweet caramel bread coffee, sulfuraceous estery chemical, musty, sweet, brown caramellic, bready and coffee"
"105-01-1","fruity floral winey woody pineapple"
"705-86-2","fresh sweet oily coconut fruity peach creamy dairy, sweet, creamy, lactonic, fatly, coconut, milky"
"583-33-5","like salicylic acid ester of butyl alcohol"
"5454-28-4","green fruity licorice grassy oily winey starfruit pear tropical"
"7779-80-8","green herbal fruity"
"13351-61-6","floral lily of the valley woody"
"105-79-3","fruity pineapple green apple skin green apple sour tropical peach earthy, sweet, estry, fruity pineapple, green apple, peach and tropical"
"28219-60-5","sandalwood creamy woody milky waxy greasy musk"
"93981-50-1","warm dark red rose leather metallic fruity"
"99948-88-6","woody vetiver earthy rooty"
"70092-23-8","woody vetiver earthy rooty"
"106-18-3","waxy soapy fruity peanut, weak, waxy and soapy with a slightly fermented dairy nuance"
"2052-15-5","fruity herbal waxy caramel savory"
"68480-06-8","fresh dewy waxy rose petal amber"
"24683-00-9","green pea green bell pepper green pea galbanum"
"110-19-0","sweet fruity ethereal banana tropical, sweet, fruity, etherial with an apple banana nuance"
"15987-00-5","anise licorice"
"13925-06-9","herbal green sugar syrup"
"6297-41-2","aromatic floral fruity chamomile rose"
"50623-57-9","orange apricot rose"
"589-75-3","butter ether herbal dank"
"142-77-8","mild fatty"
"19825-93-5","chamomile"
"7779-78-4","green floral herbal celery creamy"
"98-54-4","oakmoss leather"
"58555-74-1","citrus orange fresh sweet, sweet, citrus and peely"
"5989-27-5","citrus orange fresh sweet, sweet, citrus and peely"
"6066-49-5","herbal phenolic celery"
"24351-71-1","garlic"
"2052-14-4","harsh clover ethyl benzoate"
"123-95-5","mild fatty oily"
"6728-26-3","green banana aldehydic fatty cheesy, sharp, penetrating fresh leafy green, clean, fruity with herbal and spicy herbal nuances"
"18277-27-5","raw green herbal"
"68555-60-2","sweet leaf violet green"
"22104-80-9","waxy fresh air citrus rose rue"
"4426-79-3","green"
"25564-22-1","woody isojasmone jasmin tuberose"
"6789-80-6","green fatty grassy weedy fruity apple"
"22629-49-8","citrus waxy mandarin skin fresh aldehydic sea breeze"
"68738-99-8","fresh green sweet floral orangeflower leafy"
"7785-66-2","floral herbal warm fruity"
"591-68-4","sweet fruity pineapple green raspberry tropical, sweet, fruity, pineapple, green, tropical and tutti-frutti"
"10588-10-0","ethereal fruity"
"1006-27-5","floral minty earthy hawthorn animal anisic"
"495-40-9","camphor cherry walnut hazelnut"
"67770-79-0","warm fatty animal costus root coconut"
"109-21-7","fruity banana pineapple green cherry tropical fruit ripe fruit juicy fruit, sweet, fruity, fresh, diffusive and ripe"
"103-61-7","soft fruity winey cognac cinnamyl balsamic"
"101-49-5","green waxy sweet honey hyacinth"
"58-08-2","odorless, no apparent odor"
"66219-01-0","pleasent odor"
"68926-75-0","radiant woody patchouli ambergris"
"464-15-3","mild borneol"
"111-70-6","musty leafy violet herbal green sweet woody peony, musty, pungent, leafy green, with vegetative and fruity nuances of apple and banana"
"465-31-6","menthol musty camphor"
"112-53-8","earthy soapy waxy fatty honey coconut"
"111-71-7","fresh aldehydic fatty green herbal wine-lee ozone"
"103-41-3","sweet balsam floral fruity cherry, sweet, spicy, floral, with a powdey balsamic nuance"
"1365-19-1","floral herbal earthy green"
"89-79-2","minty cooling medicinal woody"
"57576-09-7","woody sweet peppermint tropical, woody, sweet, camphoreous, cooling and medicinal with a seedy berry undernote"
"8028-89-5","burnt sugar"
"13466-78-9","citrus terpenic herbal pine solvent resinous phenolic cypress medicinal woody"
"87-25-2","sweet floral grape orangeblossom wintergreen"
"465-28-1","pleasent mild"
"5837-78-5","sweet fruity tutti frutti tropical berry floral caramel"
"499-74-1","spearmint"
"431-03-8","strong butter sweet creamy pungent caramel, sweet, creamy, buttery, pungent, with a pungent caramellic nuance"
"4732-13-2","spicy herbal carrot"
"499-71-8","minty"
"123-51-3","fusel oil alcoholic whiskey fruity banana, fusel, alcoholic, pungent, etherial, cognac, fruity, banana and molasses"
"3796-70-1","fresh green fruity waxy rose woody magnolia tropical"
"3848-24-6","dry sweet caramel butter oily fatty creamy phenolic fruity, sweet, creamy, caramellic, buttery with a fruity jammy nuance"
"74431-24-6","minty fruity metallic spearmint creamy mossy candy spicy"
"97-45-0","minty fruity metallic spearmint creamy mossy candy spicy"
"472-97-9","warm woody moss spicy earthy"
"4586-22-5","woody spicy earthy"
"103-36-6","sweet balsam fruity spicy powdery berry plum"
"14595-54-1","musk animal natural fruity powdery"
"30960-39-5","soft woody cedar"
"105-45-3","fresh fruity citrus green"
"93-58-3","phenolic wintergreen almond floral cananga"
"10402-48-9","sweet fruity tropical rose herbal rum"
"109-94-4","ethereal green alcohol rose cognac, etherial, lifting, fermented, winey and cognac"
"112-66-3","sweet fresh laundared cloths clean waxy"
"1191-16-8","sweet fresh banana fruity jasmin ripe heliotrope balsam"
"489-86-1","mild guaiacwood tea rose"
"101-97-3","sweet floral honey rose balsam cocoa, floral honey, rosy with balsamic dark chocolate and cocoa notes with anisic black licorice nuances"
"542-55-2","sweet chemical ether fruity, sweet, chemical, ethereal and slight fruity"
"501-19-9","spicy carnation"
"1679-07-8","alliaceous onion garlic horseradish vegetable celery eggy, alliaceous, onion, garlic, horseradish, vegetable-celery, egg, sauteed meat"
"1115-11-3","pungent green ethereal nutty anisic fruity, diffusive, pungent, green, ethareal, sharp penetrating, nutty and anisic"
"10339-55-6","fresh bois de rose herbal wet green lavender bergamot"
"122-72-5","sweet balsam storax spicy cinnamon, balsamic, spicy, cinnamic and fruity with honey and hay-like nuances"
"73018-51-6","citrus saffron green lime terpene, fresh, citrus lime, terpy and woody with cold pressed lemon nuances of terpineol and linalool, reminiscent of tropical longan fruit., citrus"
"65405-72-3","dry woody amber dusty powdery"
"501-92-8","phenolic medicinal herbal"
"24851-98-7","floral oily jasmin green lactonic tropical natural"
"104-76-7","citrus fresh floral oily sweet"
"50607-64-2","sweet fruity citrus green grape cumin"
"3391-83-1","sweet oily incense musk amber animal"
"111-79-5","sweet green waxy violet pear fruity melon vegetable, sweet, green, waxy, fruity and melon-like"
"54546-26-8","herbal spice chamomile green basil"
"110-38-3","sweet waxy fruity apple grape oily brandy, sweet, waxy, fruity, apple"
"5660-60-6","soft warm spicy cinnamon allspice"
"83977-12-2","soft warm spicy cinnamon allspice"
"247219-77-8","soft warm spicy cinnamon allspice"
"112-17-4","waxy clean fresh laundered cloths citrus soapy, waxy, sweet, fatty, creamy and slightly soapy"
"87-29-6","balsam fruity grape"
"5320-75-2","balsam spicy buttery fruity"
"532-08-1","clove cinnamon"
"7492-65-1","chrysanthemum spicy tolu balsam"
"638-49-3","powerful ethereal fruity unrip banana green earthy"
"61792-12-9","woody cinnamyl green herbal"
"84254-87-5","woody cinnamyl green herbal"
"54340-90-8","green cortex herbal nasturtium"
"2719-08-6","very mild fruity powdery strawberry"
"93843-13-1","fresh green woody lemon fruity"
"7149-26-0","fresh linalool orange blossom herbal gardenia woody"
"16491-36-4","fresh green apple fruity wine metallic buttery, fresh, green apple, fruity and vegetative with fleshy grape nuances"
"143-13-5","waxy clean green tropical fruity, sweet, waxy and fruity with a green, tropical fruit nuance"
"10444-50-5","sweet citrus lemon orange"
"18383-49-8","sweet caraway mint spearmint spicy"
"68141-17-3","aldehydic amber lemon green waxy"
"60763-41-9","ethereal jasmin floral aldehyde green fruity"
"15760-18-6","fresh sweet clean citrus rose warm herbal"
"67923-82-4","fresh rose fruity minty"
"10482-77-6","verbena rose dryed rose petals"
"10580-25-3","fine rose fruity floral"
"10482-79-8","palmarosa sweet mellow red rose"
"25312-34-9","ionone tropical sweet floral violet woody, berry, sweet ionone-like, with a woody floral powdery note"
"7540-53-6","rose herbal honey"
"22029-76-1","sweet herbal floral violet tropical balsam woody, sweet, woody, berry, powdery, floral and fruity"
"68922-10-1","honey rose herbal chamomile black currant apple"
"22030-19-9","sweet berry raspberry violet jam woody, sweet, woody, ionone-type raspberry notes with floral, seedy and jammy strawberry nuances"
"52210-18-1","sweet woody floral violet berry"
"20780-48-7","fresh woody bergamot citrus floral"
"5502-75-0","fresh clean floral magnolia hydroxycitronellal cumin grassy"
"147060-73-9","waxy citrus lime floral"
"4442-79-9","floral waxy cool green peony lily dewy rose"
"34902-57-3","sweet musk waxy"
"99-86-5","woody terpene lemon herbal medicinal citrus, citrusy, woody, terpy with camphoraceous and thymol notes. it has spicy and juicy citrus nuances"
"6790-58-5","ambergris old paper sweet labdanum dry, woody, pine, cedar-like with a green seedy and tea-like nuance"
"58567-11-6","woody cedar ambergris dry dusty amber"
"67801-65-4","green tart citrus herbal cortex aldehydic"
"93952-58-0","sweet waxy rose honey licorice"
"24691-15-4","fresh green herbal natural citrus woody"
"61920-45-4","old wood earthy fruity green herbal sawen wood"
"5331-14-6","watercress mushroom gardenia green metallic"
"5934-29-2","odorless"
"119-61-9","balsam rose metallic powdery geranium"
"122-67-8","sweet balsam fruity like labdanum"
"116-26-7","fresh herbal phenolic metallic rosemary tobacco spicy, woody, spicy, phenolic, camphoreous, medicinal and powdery with an herbal undernote"
"3209-13-0","oakmoss fruity iodine woody hay"
"2345-26-8","sweet floral fruity green peach apricot rose, sweet floral fatty fruity green citrus tropical rose, sweet, floral, fruity and green with powdery citrus nuances"
"536-60-7","strong cumin caraway spicy herbal leather"
"4864-61-3","fresh bergamot woody green grapefruit rose apple mint, green, waxy, aldehydic, fatty and citrus-like with a slightly minty, anisic nuance"
"69103-20-4","sweet metallic fresh herbal lavender opoponax clary pear"
"21722-83-8","mint rose raspberry plant-like plastic green"
"123-35-3","peppery terpene spicy balsam plastic, terpy, herbaceous, woody with a rosy celery and carrot nuance"
"1506-02-1","strong sweet amber fruity musk powdery"
"21145-77-7","strong sweet amber fruity musk powdery"
"118-60-5","mild orchid sweet balsam"
"10032-02-7","rose geranium fruity waxy"
"103-05-9","clean fresh green rose linalool lily violet, clean, fresh, floral reminiscent of rose and violet"
"23445-02-5","spicy minty"
"1337-83-3","clean green aldehydic rose"
"66408-78-4","fresh floral lemon clean"
"7492-67-3","fresh sweet waxy floral aldehydic honeysuckle muguet, citrus, sweet, melon, green with a slight floral nuance"
"123-76-2","sweet caramel acidic acetoin buttery, sweet, guaiacol-like, creamy, acidic and slight vanillin-like"
"13816-33-6","spicy cumin dry green"
"770-85-4","basil orris"
"37609-25-9","dry powdery musk amber civet"
"35951-24-7","dry powdery musk amber civet"
"1725-01-5","sweet musk oily fruity animal floral"
"52514-67-7","sweet creamy vanilla phenolic"
"488-10-8","woody herbal floral spicy jasmin celery, woody, herbal and floral, with a citrus nuance"
"17369-59-4","celery herbal cortex lovage maple fenugreek phenolic brothy vegetable brown, celery, sweet, lovage and maple-iike with herbal, brown, vegetative nuances"
"56014-72-3","celery herbal cortex lovage maple fenugreek phenolic brothy vegetable brown, celery, sweet, lovage and maple-iike with herbal, brown, vegetative nuances"
"94704-89-9","celery herbal cortex lovage maple fenugreek phenolic brothy vegetable brown, celery, sweet, lovage and maple-iike with herbal, brown, vegetative nuances"
"5331-32-8","pine woody camphor borneol"
"1321-89-7","sweet floral rose lemon citrus"
"53398-85-9","fresh green apple sweet fruity pear, fresh green, unripe fruit apple, pear and berry-like, with an acidic sweaty nuance"
"35154-45-1","fresh green apple fruity tropical pineapple, green, fruity, floral and dirty"
"4747-07-3","sweet painty herbal lavender fruity"
"99-85-4","oily woody terpene lemon/lime tropical herbal, terpy, sweet, citrus, with tropical and lime nuances"
"59056-62-1","woody amber vetiver acetate sandalwood clary sage"
"29350-73-0","fresh woody longifolone"
"108910-53-8","fresh woody longifolone"
"4364-06-1","fresh green spicy cinnamon herbal"
"6221-92-7","undecylenic smoke metallic green"
"2785-87-7","clove sharp spicy sweet phenolic powdery allspice"
"2986-53-0","vetiver oil"
"105-21-5","sweet coconut nutty caramel tonka hay, sweet, coconut, coumarin, iactonic, creamy and powdery"
"69103-01-1","fresh herbal bergamot stem floral buchu"
"53823-06-6","algae"
"21835-01-8","sweet caramel maple fenugreek, sweet, brown, caramellic, maple, brown sugar, rum, whiskey, furanone"
"128-50-7","sweet balsamic citrus pine herbal"
"3661-77-6","musk"
"3100-36-5","musk clean laundered cloth dry balsamic waxy animal floral tobacco"
"13877-91-3","citrus tropical green terpene woody green, tropical, green, terpy and woody with vegetable nuances"
"25225-08-5","fresh woody herbal seashore fruity apple"
"41890-92-0","sweet sandalwood soapy floral woody"
"108-93-0","camphor menthol phenol"
"5435-64-3","aldehydic dry grassy weedy green citrus fatty natural"
"7779-16-0","mild neroli orange blossom"
"2412-73-9","mild balsamic floral herbal"
"1551-44-6","fruity apple pineapple floral"
"1129-47-1","fruity"
"7779-17-1","fruity peach cherry maraschino cherry bitter almond cinnamyl"
"138964-30-4","fruity peach cherry maraschino cherry bitter almond cinnamyl"
"5454-26-2","fruity"
"6243-10-3","fruity pineapple"
"61197-12-4","meaty liver sweet rubbery"
"28217-92-7","green musty nutty"
"42288-75-5","honey rose"
"7774-44-9","apple banana fruity berry"
"100-53-8","sharp alliaceous onion sulfurous garlic horseradish mint coffee, sharp, sulfuraceous, onion, garlic, horseradish, mint and coffee"
"104-64-3","sweet floral honey hyacinth cinnamon"
"6281-40-9","sweet fruity green"
"98-53-3","woody mint patchouli musk leather"
"122-74-7","floral balsam hyacinth mimosa"
"4695-62-9","camphor thuja cedarleaf herbal earthy woody, cooling, camphoreous, mentholic, pine-like, terpenic and fresh"
"928-95-0","fresh green leafy fruity unripe banana, fresh fatty green, fruity, vegetative, with leafy and herbal nuances"
"68133-72-2","fresh watery ozone green waxy citrus aldehydic"
"91-10-1","smoky phenolic balsamic bacon powdery woody, sweet, phenol, smoky, medicinal, balsamic"
"76649-17-7","fresh green natural metallic tropical waxy"
"18824-63-0","fresh floral plastic citrus green"
"3208-40-0","fruity green fatty cucumber skin nasturtium galbanum woody nut skin"
"93-91-4","acetophenone balsam woody dry opoponax vanilla"
"15707-23-0","nutty peanut musty corn raw earthy bread, nutty, peanut, musty, corn-like with raw earthy and bready nuances"
"141-16-2","sweet fruity floral tropical green geranium waxy, sweet, fruity, floral and perfume-like with a green citrus iinalool nuance"
"106-73-0","sweet fruit green orris waxy floral berry, sweet, fruity and green, with a waxy apple like note"
"105-85-1","bergamot cucumber rose apricot peach plum, sweet, green, waxy, floral, apricot, citrus, fruity and mandarin"
"2051-78-7","sweet pungent fruity green pineapple waxy tropical, sweet pungent fruity green pineapple, with waxy tropical nuances"
"20780-49-8","fresh wax clean rose sweet fruity honey"
"5454-09-1","sweet fruity waxy slightly rose, sweet, fruity, waxy, slightly rosy"
"15707-24-1","raw nutty green pepper, raw nutty and green pepper"
"120-92-3","minty"
"623-17-6","sweet fruity banana horseradish"
"59151-19-8","sweet anise floral clean autumn jasmin"
"59052-82-3","fresh clean cloths sweet woody"
"52-90-4","sulfury"
"76649-24-6","sweet apricot kernel"
"534-15-6","sharp sweet alcohol ether green new mown hay"
"7493-57-4","green reseda leafy hyacinth herbal"
"87641-23-4","dry woody tobacco-leaf thuja"
"14507-02-9","fatty waxy citrus melon, fatty and waxy, white meat chicken and turkey with a slight melon fruity and dairy nuance"
"87641-24-5","fruity green rhubarb celery galbanum"
"825-51-4","clean rose minty muguet"
"71566-53-5","aromatic herbal natural celery cumin soil natural forest"
"67874-78-6","fruity mild apricot plum rose"
"34764-02-8","fresh moss aldehydic waxy green orange, waxy, green, aldehydic and orange with cognac and coconut nuances"
"7779-41-1","waxy herbal citrus green neroli"
"21661-97-2","citrus aldehydic cucumber"
"73545-19-4","bitter orange"
"14436-32-9","waxy green fruity fatty soapy, waxy, green, fatty, soapy with a slight creamy cheese type nuance"
"57074-37-0","waxy fatty fruity"
"68797-68-2","lily nitrile woody fresh"
"94406-15-2","herbal thuja juniper black currant"
"19487-61-7","waxy fatty"
"67662-96-8","rose spice rhodinol geranium blueberry"
"50816-18-7","moist rose petal peony magnolia ambrette seed effect"
"71566-51-3","bitter walnut nutty nut skin acorn saffron citrus herbal hot"
"18189-07-6","floral grape neroli"
"5451-52-5","honeysuckle orange blossom"
"560-88-3","green fresh woody salicylate pine needle bisabolene"
"5454-19-3","ether rum fruity fatty cognac"
"1195-32-0","phenolic spicy styrene clove guaiacol, phenolic, spicy, styrene, eugenol and guaiacol-like with musty, coffee and nutty nuances"
"69103-24-8","fresh citrus green herbal cumin powdery clean"
"2050-87-5","garlic green onion metallic"
"515-03-7","sweet balsam clary amber woody weedy"
"141-04-8","mild estery"
"7774-47-2","oily coconut butter"
"107-88-0","odorless"
"25265-71-8","slight alcoholic"
"84-74-2","faint odor"
"77-90-7","very faint herbal wine sweet"
"2120-70-9","fresh green cortex leafy hyacinth ozone leather"
"59558-23-5","animal fecal hay ylang jasmin indole green"
"544-40-1","green grassy violet-leaf herbal rose geranium, onion garlic, horseradish, rubbery, savory and vegetative"
"123-25-1","mild fruity cooked apple ylang"
"131-11-3","odorless"
"111-77-3","mild musty"
"141-05-9","fruity banana citrus"
"18138-04-0","musty nut skin earthy roasted hazelnut toasted potato dusty foliage vegetable, musty, nut skin, earthy, toasted, potato bin, green and meaty"
"87-91-2","mild fruity wine caramellic"
