"CAS","odor_goodscents"
"8002-33-3","bland fatty"
"90-87-9","floral leafy hyacinth green mushroom earthy walnut, sweet, floral, citrus, green with a honey nuance"
"1323-00-8","woody floral cashew nutty powdery orris, woody, floral ionone, with acidic green berry nuances"
"67634-02-0","floral rose absolute green powdery tropical"
"151-21-3","almost odorless"
"100-06-1","sweet hawthorn anisic powdery balsamic acacia, sweet, anisic, vanilla-like, with powdery balsamic and benzaldehyde nuances"
"98-86-2","sweet pungent hawthorn mimosa almond acacia chemical, sweet, cherry pit, marzipan and coumarinic. it has a slight almond nutty and heliotropin-like vanilla nuance"
"1211-29-6","floral fresh petal magnolia oily waxy, sweet, fruity, waxy, floral and green"
"124-25-4","fatty waxy amber incense dry citrus peel musk, fatty, waxy, dairy, creamy and fishy with a fruity, pear nuance"
"112-31-2","sweet aldehydic waxy orange peel citrus floral, sweet, aldehydic, orange, waxy and citrus rind"
"143-08-8","fresh clean fatty floral rose orange dusty wet oily"
"3033-23-6","rose cortex green floral geranium powdery metallic"
"112-30-1","fatty waxy floral orange sweet clean watery"
"65443-14-3","fruity peach apricot jasmin lactonic herbal lavender"
"124-13-0","aldehydic waxy citrus orange peel green herbal fresh fatty, aldehydic, waxy, citrus orange with a green peely nuance"
"124-19-6","waxy aldehydic rose fresh orris orange peel fatty peely, waxy, aldehydic, citrus, with a fresh slightly green lemon peel like nuance, and a cucumber fattiness"
"109-29-5","sweet musk balsam amber animal"
"5406-12-2","heliotrope lily lilac"
"2705-87-5","sweet pineapple tropical fruity candy waxy"
"112-45-8","waxy aldehydic rose mandarin citrus soapy fatty"
"34686-67-4","floral green fruity natural waxy jasmin tropical banana"
"34687-46-2","oily jasmin coconut milky dairy floral"
"112-54-9","soapy waxy aldehydic citrus green floral, soapy, waxy, aldehydic, citrus, orange rindy with floral nuances"
"57-55-6","odorless very slight alcoholic"
"68959-28-4","creamy fruity peach plum dairy coconut buttery, creamy, sweet, fruity peach, milky, dairy with a coconut nuance"
"40010-99-9","floral jasmin gardenia tuberose"
"110-41-8","fresh amber aldehydic moss citrus tuberose metallic waxy coumarinic, gassy, diffusive, metallic, waxy, with coumarin and citrus nuances"
"9176-12-1","chamomile herbal celery lovage sassafras jasmin"
"58214-97-4","balsamic powdery cinnamyl sweet storax cinnamon"
"77-92-9","odorless"
"60788-25-2","sweet lily muguet rose aldehydic lychee waxy"
"55066-49-4","aldehydic lily green fresh waxy woody"
"64-17-5","strong alcoholic ethereal medical"
"104-61-0","coconut creamy waxy sweet buttery oily, sweet, creamy, coconut, fatty with oily buttery nuances"
"106-21-8","waxy soapy aldehydic leathery musty citrus green"
"589-59-3","sweet fruity apple raspberry green banana, sweet, fruity, apple and green"
"99016-42-9","odorless"
"539-82-2","sweet fruity apple pineapple green tropical, sweet, fruity, acidic, pineapple, apple, green, berry and tropical"
"123-68-2","sweet fruity pineapple tropical ethereal rum arrack fatty cognac, sweet, fruity, estry, juicy, caproate-like, pineapple"
"97-62-1","sweet ethereal fruity alcoholic fusel rummy, sweet, etherial and fruity with pungent, alcoholic, fusel and rummy nuances"
"69300-15-8","light peach fruity floral jasmin lactonic"
"69102-96-1","fresh floral sweet lily citronella oil"
"72968-30-0","fresh floral sweet lily citronella oil"
"104-67-6","fruity peach creamy fatty lactonic apricot ketonic coconut"
"15323-35-0","strong sweet musk amber powdery dry fruity"
"23726-91-2","fruity floral berry plum blackcurrant honey rose tobacco, fruity, woody and berry with a minty note"
"68039-24-7","citrus natural lemon"
"1405-92-1","sharp dry woody cedar peanut waxy vetiver"
"3658-77-3","sweet cotton candy caramel strawberry sugar, sweet, slightly burnt brown caramellic, cotton candy with a savory nuance"
"93-54-9","sweet floral balsam"
"144020-22-4","ambergris woody cedar dry tobacco musk"
"107-75-5","floral lily sweet green waxy tropical melon"
"26896-48-0","sweet amber musk floral sandalwood"
"122-40-7","sweet floral oily fruity herbal jasmin, sweet, floral, fruity, tropical and green with a powdery nuance"
"141-14-0","floral green neroli waxy fruity rose, floral, green, waxy and citrus with fruity nuances"
"25415-62-7","apple fresh fruity"
"68916-14-3","woody cedar fatty amber vetiver acetate"
"4180-23-8","sweet anise licorice mimosa"
"13567-39-0","woody amber tobacco sandalwood fresh linalyl acetate patchouli"
"64577-91-9","green leafy vegetable"
"54484-73-0","natural green floral earthy fungal"
"105-13-5","sweet powdery hawthorn lilac rose floral hyacinth, sweet, powdery creamy, balsamic, coumarin and slightly lactonic, cherry and licorice nuance"
"123-11-5","sweet powdery mimosa floral hawthorn balsam"
"104-21-2","sweet powdery balsam vanilla fruity plum cherry tonka"
"67-64-1","solvent ethereal apple pear"
"72797-17-2","nutty roasted hazelnut roasted peanut popcorn corn chip toasted grain nut flesh peanut butter"
"103-38-8","sweet fruity apple pineapple herbal, sweet, fruity and slightly powdery with a musty background"
"32210-23-4","woody cedar floral oily herbal balsam green fruity"
"25152-85-6","fresh green leaf floral orchid balsam fatty"
"7070-15-7","woody cedar balsamic pine"
"32974-92-8","earthy potato chip nutty popcorn corn, earthy, nutty, musty, potato and corn-like"
"141-11-7","red rose powdery spicy geranium citrus leafy"
"33467-73-1","fresh green waxy sweet vegetable grassy sharp, green, diffusive, fresh, fruity, citrus, waxy, melon and vegetable"
"3681-71-8","fresh green sweet fruity banana apple grassy, fresh green sweet fruity with apple, pear and melon nuances"
"100-52-7","strong sharp sweet bitter almond cherry, almond, fruity, powdery, nutty and benzaldehyde-like"
"67999-56-8","dry woody citrus linalyl and nopyl acetate"
"119-84-6","sweet tonka coumarinic coconut herbal cinnamon balsamic, sweet, creamy, coconut, coumarin, vanilla with a slight spice nuance"
"14765-30-1","fresh mint peppermint woody camphor, cooling, minty, mentholic, spearmint-like, with a camphoraceous undernote"
"118-61-6","sweet wintergreen mint floral spicy balsam, sweet, wintergreen, tutti frutti, cooling, spicy and balsamic"
"23787-80-6","nutty nut flesh roasted hazelnut toasted grain corn chip vegetable nut skin caramellic"
"2306-91-4","waxy banana fruity sweet cognac green, waxy, banana fruity, sweet with a dirty green nuance"
"77-83-8","sweet fruity strawberry floral honey fatty"
"140-11-4","sweet floral fruity jasmin fresh"
"68648-34-0","clean woody dry cedar earthy"
"93-18-5","naphtha floral orange blossom powdery grape"
"2272-55-1","sweet strawberry berry floral tropical, sweet, berry, strawberry, honey, floral and rosy"
"121-39-1","sweet strawberry berry floral tropical, sweet, berry, strawberry, honey, floral and rosy"
"100-51-6","floral rose phenolic balsamic, sweet, floral, fruity with chemical nuances"
"79-09-4","pungent acidic cheesy vinegar, pungent acidic and dairy-like"
"120-51-4","faint sweet balsam oily herbal"
"4023-65-8","vegetable musty nut dry toasted, vegetable"
"14620-52-1","mild fresh green waxy orchid herbal"
"103-28-6","jasmin oily fruity sweet rose tropical, sweet, fruity, powdery with tropical woody and juicy nuances"
"120-11-6","mild spicy balsam carnation"
"111-13-7","earthy weedy natural woody herbal, musty, ketonic, bleu and parmesan cheese-like with earthy and dairy nuances"
"122-63-4","sweet fruity floral banana jasmin balsam"
"28296-85-7","fruity sweet powdery floral ripe"
"118-58-1","balsam clean herbal oily sweet"
"124-04-9","odorless"
"10340-23-5","fresh waxy green melon rind tropical mushroom"
"67634-00-8","fruity green galbanum pineapple fusel"
"141-97-9","fresh fruity green apple fatty"
"10415-87-9","sweet fresh cayloxol lilac anisic earthy narcissus peony"
"1786-08-9","green weedy cortex herbal diphenyl oxide narcissus celery, green, vegetative and floral with a minty undernote"
"53767-93-4","citrus bergamot lime lavender"
"67634-20-2","fruity amber chocolate anise basil"
"459-80-3","dry weedy acidic green moldy feet woody, green weedy woody greasy sweet"
"4621-04-9","leather red rose green dusty weedy metallic"
"13257-44-8","fresh green violet foliage sweet"
"54982-83-1","sweet clean waxy musk animal"
"107-74-4","mild clean floral lily green peony"
"58430-94-7","sweet orris cumin woody fruity spicy"
"2623-23-6","mentholic minty herbal tea fruity woody floral earthy"
"124-76-5","balsam camphor herbal woody"
"110-43-0","fruity spicy sweet herbal coconut woody, cheese, fruity, ketonic, green banana, with a creamy nuance"
"68892-05-7","waxy floral leafy rose"
"112-23-2","green waxy floral herbal plum apple cucumber, green, waxy, floral, herbaceous, with a slight vegetative cucumber and unripe fruity nuance"
"5413-60-5","floral green soapy cedar pine woody"
"111-90-0","slightly ethereal"
"1576-95-0","green phenolic nasturtium ethereal medicinal aldehydic cherry narcissus metallic fruity"
"56172-46-4","sweet caramel maple fruity almond acorns nutty"
"103-64-0","strong leafy green hyacinth"
"107-95-9","odorless"
"122-68-9","sweet balsam spicy apricot"
"290311-72-7","sweet balsam spicy apricot"
"80863-62-3","odorless"
"109-42-2","fatty butter wine floral fruity"
"79-31-2","acidic sour cheese dairy buttery rancid"
"7493-63-2","green leaf floral grape"
"19139-31-2","fresh floral green magnolia plastic herbal cortex"
"118-71-8","sweet caramel cotton candy jam fruity baked bread, sweet, caramellic, cotton candy, jammy fruity, burnt with bready nuances"
"28940-11-6","fresh watery clean melon green marine ozone phenolic"
"7541-49-3","mild light floral balsam green jasmin"
"105463-44-3","woody camphor patchouli earthy rooty"
"81787-06-6","clean dry woody amber vetiver"
"88-41-5","fruity woody green apple herbal"
"105-95-3","powdery sweet floral ambrette musk woody"
"77-54-3","sharp dry woody cedar"
"55719-85-2","green sweet rose natural oily leaf herbal"
"4728-82-9","sweet ripe fruity pineapple green peach apricot, sweet, ripe fruity, pineapple with a green waxy nuance"
"7493-65-4","fatty fruity pineapple"
"7492-66-2","green fresh citrus lemon peel waxy, sweet citrus, green, floral, waxy, lemon peel"
"5146-66-7","citrus lemon nitrile aldehydic metallic"
"16930-96-4","fresh green natural oily herbal fruity"
"7493-66-5","fatty fruity"
"67883-79-8","green vegetable green banana earthy cortex herbal, green, earthy vegetative with mushroom and radish nuances"
"104-55-2","sweet spicy aldehydic aromatic balsamic cinnamyl resinous honey powdery, cassia, cinnamon, cinnamon bark and red hots"
"121-32-4","sweet creamy vanilla caramel"
"38019-89-5","sweet creamy vanilla caramel"
"90-17-5","heavy deep rose floral powdery balsamic soapy"
"111-27-3","ethereal fusel oil fruity alcoholic sweet green, pungent, etherial, fusel oil, fruity and alcoholic, sweet with a green top note"
"6485-40-1","sweet spearmint herbal minty"
"6259-76-3","fresh herbal orchid green"
"68698-57-7","dry woody peppery citrus"
"7493-68-7","fruity pineapple peach apricot apple"
"2179-57-9","alliaceous onion garlic metallic, alliceous, onion and garlic-like with metallic nuances"
"870-23-5","alliaceous sulfurous garlic onion roasted, sulfurous and alliaceous, sauteed onion and garlic, roasted, grilled and charred meaty nuances"
"28231-03-0","cedarwood woody sweet soft"
"7493-72-3","sweet waxy fruity wine creamy vinous pineapple, sweet, waxy fruity, with a winey and creamy nuance"
"4230-97-1","waxy fruity green tropical pineapple watercress metallic fatty soapy, fatty and waxy, sweet, fruity pineapple-like with a green tropical nuance"
"6091-50-5","herbal minty mentholic peppermint"
"1797-74-6","honey fruity rum"
"2408-20-0","ethereal acrylate fruity wasabi ripe tropical ripe banana nut skin, etherial, sharp, acrylate-like with an alliaceous nuance, overripe and tropical"
"10484-09-0","fruity banana pineapple wintergreen"
"30895-79-5","fruity pineapple"
"592-88-1","sulfurous onion garlic horseradish metallic, pungent, sulfurous, onion-garlic and horseradish-like with a metallic nuance"
"57-06-7","strong pungent mustard"
"41820-22-8","fresh onion garlic green gassy, fresh onion garlic-like with green gassy nuances"
"7493-71-2","green fruity berry"
"77-53-2","cedarwood woody dry sweet soft"
"7493-76-7","fruity pineapple waxy"
"2835-39-4","sweet fruity banana apple pineapple cherry, sweet, slightly pungent, fruity, banana, apple and pineapple-like"
"36977-92-1","minty cool peppermint sweet, mentholic, cooling, minty and camphoreous with a refreshing etherial lift"
"491-07-6","minty cool peppermint sweet, mentholic, cooling, minty and camphoreous with a refreshing etherial lift"
"56973-85-4","fresh green galbanum earthy weedy pineapple narcissus"
"2308-18-1","ethereal sweet wine green fermented"
"71-41-0","fusel oil sweet balsam, pungent, fermented, bready, yeasty, fusel, winey and solvent-like"
"142-92-7","fruity green apple banana sweet, green, fruity, sweet, fatty, fresh, apple and pear"
"72968-25-3","sweet woody violet citrus"
"140-10-3","balsam sweet storax"
"53399-81-8","fruity green ripe pineapple tropical ripe banana chrysanthemum privet fatty, estry, fruity and tropical with spicy, cooling nuances"
"104-54-1","sweet balsam hyacinth spicy green powdery cinnamic, cinnamon spice, floral, green and fermented with powdery balsamic nuances"
"2050-01-3","fruity ethereal tropical green grape cherry unripe banana apple cocoa, sweet, fruity, estry and green with a waxy nuance"
"91-87-2","bland jasmin lily green lemon"
"7493-79-0","sweet oily herbal green"
"103-54-8","sweet floral spicy balsam cinnamon"
"7493-80-3","fruity tobacco oily hay"
"140-27-2","sweet spice melon cherry green apple, sour, fermented and winey, yeasty with woody and fruity nuances"
"16587-71-6","woody dry orris earthy camphor"
"107-92-6","sharp acetic cheese butter fruit, sharp, dairy-like, cheesy, buttery with a fruity nuance"
"104-87-0","fruity cherry deep phenolic"
"5392-40-5","sharp lemon sweet"
"7549-37-3","green floral citric lemon lime natural"
"112-14-1","green earthy mushroom herbal waxy"
"10484-36-3","sweet balsam floral spice carnation"
"7779-66-0","sweet butter fruity caramel"
"5396-89-4","sweet benzyl propionate and acetate floral fruity"
"7779-67-1","sweet green floral fruity sour apple rose raisin caramel"
"5442-00-2","floral mint green geranium muguet balsam"
"1334-82-3","fennel mild oily fruity herbal"
"659-70-1","sweet fruity green ripe apple jammy tropical, sweet fruity, green apple and estry"
"25304-14-7","woody herbal cedarleaf thujone minty"
"7493-82-5","ethereal fruity unripe banana coconut lemon"
"542-46-1","clean musk dry animal sweet"
"17597-95-4","fresh green leafy sweet floral fruity"
"109-25-1","fruity herbal grassy banana unripe fruit"
"151-19-9","fresh linalool woody blueberry sweet rose"
"40853-53-0","fresh herbal mint rosemary woody"
"66062-78-0","sweet fresh woody earthy patchouli vetiver herbal"
"554-12-1","fresh harsh rum fruity strawberry apple"
"6309-51-9","wine waxy oily fatty peach, winey, alcoholic, fatty, creamy, yeasty and fusel"
"4501-58-0","herbal green woody amber leafy"
"112-06-1","fresh green rum ripe fruit pear apricot woody, green, waxy, fatty, citrus, aldehydic, winey and woody"
"81782-77-6","green oily violet lily seedy fruity kiwi"
"4430-31-3","sweet herbal coumarin tonka woody, sweet, creamy, lactonic, coconut, coumarin, with milky and creamy vanilla nuances"
"91-64-5","sweet hay tonka new mown hay"
"106-44-5","phenolic narcissus animal mimosa"
"495-76-1","sweet powdery vanilla"
"140-39-6","narcissus phenolic animal"
"5406-58-6","woody sandalwood camphor methyl acetophenone sweet"
"33662-58-7","oakmoss sweet seaside phenolic"
"80480-24-6","fresh oily green jasmin herbal spicy privetblossom"
"104-93-8","naphthyl cresol ylang powdery nutty"
"20702-77-6","bland odor, no apparent odor"
"104468-21-5","fresh herbal fruity floral chamomile red rose"
"84029-93-6","sweet cardamom floral fruity tropical fresh"
"101-94-0","animal rose honey narcissus lily hyacinth"
"600-14-6","pungent sweet butter creamy caramel nutty cheese, buttery, nutty, toasted, caramellic, diacetyl and acetoin notes"
"75147-23-8","fresh fruity natural buchu leaf oil clean"
"122-03-2","spicy cumin green herbal, spicy, green, cumin-like with green herbal spice nuances"
"56747-96-7","spicy moss earthy resinous"
"7779-70-6","fruity oily apricot floral"
"82784-84-7","fresh green sweet ozone melon"
"62488-24-8","fragrant"
"40853-56-3","fresh herbal mint woody"
"103-95-7","floral cyclamen fresh rhubarb musty green"
"627-90-7","soapy waxy fatty cognac coconut, soapy, waxy, fatty with a slight buttery nuance"
"540-18-1","sweet fruity banana pineapple cherry tropical, sweet, fruity, banana, pineapple and cherry, with a tropical nuance"
"638-25-5","orris sweet winey cognac elderflower fatty"
"4940-11-8","sweet caramel jam strawberry cotton candy"
"617-35-6","ether fruity sweet sharp rum vegetable caramel, etherial, fruity, sweet, with a sharp rum-like top note"
"106-02-5","musk animal powdery natural fruity, tobacco, coumarin, heliotropine, powdery, licorice and brown"
"106-68-3","fresh herbal lavender sweet mushroom, musty, mushroom, ketonic, moldy and cheesy fermented with a green, vegetative nuance"
"68683-25-0","fresh watery floral muguet"
"604-68-2","odorless"
"89-43-0","floral lily orange blossom sweet"
"1118-39-4","citrus bergamot lavender floral woody nutmeg"
"72403-67-9","fresh lily magnolia sweet citrus freesia green"
"105-53-3","sweet fruity green apple, sweet, green, apple and fruity"
"21662-09-9","citrus aldehydic orange watery cardamom"
"84-66-2","odorless"
"76649-16-6","green fruity waxy cognac, green, fruity and oily with a pineapple, apple waxy nuance"
"18479-51-1","bois de rose woody citrus blueberry weedy"
"2306-78-7","fresh sweet citrus waxy freesia woody"
"85-91-6","fruity musty sweet neroli powdery phenolic wine"
"68555-57-7","sweet rose fruity neroli petitgrain"
"100-86-7","clean floral green rose cortex oily rhubarb"
"151-05-3","sweet floral fruity rose green pear berry jasmin powdery"
"52474-60-9","citrus ozone aldehydic grapefruit muguet"
"150-78-7","sweet green new mown hay fennel"
"4861-85-2","sweet honeysuckle powdery viney, sweet, honey, floral, with a rose-like nuance"
"24717-85-9","rose fruity floral geranium leafy tea"
"68345-22-2","sweet green floral almond rose cortex, sweet, honey, brown, floral, cocoa, dried fruit with powdery nuances"
"1604-28-0","cinnamon coconut spice woody sweet weedy, sweet, green, spice-like with a cooling herbaceous nuance"
"637-78-5","fruity ether sweet pineapple banana, fruity etherial, sweet with pineapple & banana nuances"
"57606-04-9","odorless"
"9005-38-3","odorless"
"101-84-8","geranium leaf green phenolic"
"9005-35-0","odorless"
"1334-78-7","sweet cherry chemical coumarin powdery, sweet, cherry and chemical with a powdery coumarin like nuance"
"65894-83-9","green nut skin sulfurous burnt cocoa corn"
"60523-21-9","fruity tropical tutti frutti rummy green strawberry earthy berry, green, sweet, fruity, tufti-frutti-iike with tropical and rummy nuances"
"1197-01-9","sweet fruity cherry coumarin floral camphor, sweet, fruity, cherry, coumarin, floral, camphoreous, cooling"
"5362-56-1","ethereal spicy green grassy aldehydic cooked apple cognac woody, pungent, etherial, fresh green apple-like, aldehydic, cognac and woody"
"141-78-6","ethereal fruity sweet weedy green, etherial, fruity, sweet, grape and rum-like"
"1319-88-6","cherry bitter almond sweet, faint musty red fruity with a slight cherry pit nuance"
"35854-86-5","fresh green melon waxy honeydew cantaloupe cucumber clean, waxy, green, vegetable-like, melon, honeydew, with juicy and fatty nuances"
"93-89-0","fruity dry musty sweet wintergreen, sweet, wintergreen, fruity, medicinal, cherry, grape"
"105-54-4","fruity juicy fruit pineapple cognac"
"123-66-0","sweet fruity pineapple waxy green banana, sweet, fruity, pineapple, waxy, fatty and estry with a green banana nuance"
"76649-14-4","creamy mushroom melon rind waxy, green, mushroom, melon rind with waxy nuances"
"2226-05-3","dry sawdust woody patchouli camphor mint"
"21280-29-5","dry animal amber ambergris civet musk"
"868-57-5","ethereal estery fruity tutti frutti green apple lily of the valley powdery fatty, etherial, iifting, fruity, tutti-frutti and ripe with a fatty, green nuance"
"7452-79-1","sharp sweet green apple fruity, fruity, estry and berry with fresh tropical nuances"
"4208-49-5","caramel fruity jam"
"124-06-1","sweet waxy violet orris, sweet, waxy"
"123-29-5","fruity rose waxy rum wine natural tropical"
"1885-38-7","nitrile cinnamon cassia deep cumin"
"105-37-3","sweet fruity rum juicy fruit grape pineapple, sweet, etherial, rummy, grape, winey and fermented with an eggnog nuance"
"692-86-4","waxy fruity clean creamy soapy cognac, fatty, waxy and fruity with sweet creamy and soapy nuances"
"2437-25-4","dry citrus orange peel metallic spicy"
"137-03-1","fresh fruity peach isojasmone oily tropical"
"67634-16-6","fresh floral herbal green petal gardenia minty"
"67634-17-7","fresh floral herbal green petal gardenia minty"
"97-53-0","sweet spicy clove woody, sweet, spicy, clove like, woody, with phenolic savory ham and bacon notes and cinnamon and allspice nuances"
"93-28-7","fresh sweet woody clove floral carnation malt spice"
"2568-25-4","bitter narcissus sweet naphthalic woody"
"97-42-7","green minty spearmint nasturtium herbal rummy grape pear spicy, sweet, green, fruity, pulpy and herbal"
"38462-22-5","sulfury minty green fruity berry buchu fruity tropical peach, fruity, berry and tropical with a raspberry, minty nuance"
"7774-82-5","powerful waxy citrus peel tangerine, aldehydic, citrusy, waxy, powdery, soapy and creamy"
"20407-84-5","citrus metallic mandarin orange waxy aldehydic"
"4602-84-0","mild fresh sweet linden floral angelica"
"7786-61-0","sweet spicy clove carnation phenolic peppery smoky woody powdery"
"13851-11-1","fresh sweet pine fir herbal citrus"
"25225-10-9","floral rose musk fruity geranium"
"67-03-8","sour mild bitter"
"59056-64-3","warm woody amber animal clary dry"
"68133-76-6","green oily melon rind banana peel cucumber skin tea, green, oily and fatty with a cucumber vegetative and fruity melon rind like nuance and a slight hint of a floral green tea"
"59056-70-1","woody amber cedar vetiver clary sage dry"
"67634-25-7","citrus floral green grapefruit gardenia petal"
"58-86-6","smoky woody sweet caramel"
"67634-14-4","ozone clean fresh green marine"
"67634-15-5","ozone clean fresh green marine"
"65504-96-3","fruity winey"
"99-48-9","minty spearmint cooling green herbal caraway spicy"
"3738-00-9","dry woody amber ambergris musk sweet"
"41519-23-7","fruity green pear apple tropical mango tomato leaf violet leaf, sweet fruity apple and pear, fading to a slight green character"
"18640-74-9","green wasabi privet tomato leaf earthy vegetable metallic, green, vegetable, musty with a waxy nuance"
"15679-13-7","tropical fruit green vegetable nut rooty earthy, musty alliaceous earthy sulfury slight fruity, coffee, meaty"
"27593-23-3","tonka lactonic coconut creamy fatty waxy, coconut creamy, sweet, brown with a fatty waxy nuance"
"4351-54-6","ethereal cooling sweet fruity banana cherry jam, ethereal and cooling with sweet fruity banana nuances"
"6290-17-1","fresh fruity apple strawberry licorice"
"18871-14-2","floral herbal oily green jasmin mushroom lactonic"
"15764-16-6","naphthyl cherry almond spice vanilla, sweet, naphthalene, chemical, almond, powdery, spice, cherry and vanilla"
"16356-11-9","fresh green greasy resin galbanum green pepper, fresh green, cucumber, waxy, melon and vegetative, citrus"
"108-48-5","nutty amine woody bready cocoa oily, nutty, amine, woody, bready and vegetable-like"
"102-04-5","bitter almond benzaldehyde plastic seedy, sweet, powdery, and honey with floral rose nuances"
"94278-27-0","onion garlic sulfurous coffee vegetable animal, onion, garlic, sulfuraceous, coffee and vegetable notes"
"68555-95-3","lime citrus lemon herbal terpene"
"3249-68-1","sweet green sweaty fruity berry, sweet, green, sweaty with fruity notes"
"10486-19-8","fresh clean aldehydic soapy citrus petal waxy grapefruit peel"
"105-86-2","fresh rose neroli tea rose green, floral, green, fruity, apple and peach with tropical nuances"
"71648-43-6","floral tropical honey rose fruity sweet balsam, floral, powdery, rosy, honey and dried fruit-like with balsamic undernotes"
"68555-63-5","sweet caramellic bready jammy strawberry berry, rich sweet baked cookie, similar to furaneol with a jammy pineapple, berry and sweet tropical nuance"
"105-90-8","floral fresh waxy fruity rose tropical citrus geranium powdery, floral, rosey, waxy, honey, tropical and vegetative, with a powdery nuance"
"65416-14-0","sweet strawberry fruity tropical berry cotton candy, sweet, fruit and slight burnt, caramelized sugar jamy notes with cotton candy afternote"
"2548-87-0","fresh cucumber fatty green herbal banana waxy green leaf"
"68527-74-2","sweet vanilla chocolate creamy dairy powdery, sweet, vanillin, slightly powdery with phenolic cocoa nuances"
"4674-50-4","grapefruit peel citrus gardenia woody, grapefruit, citrus, orange, sweet peely with a woody nuance"
"874-90-8","sweet floral hawthorn hay coumarin"
"589-38-8","sweet fruity waxy rum grape, sweet, fruity, waxy and diffusive"
"39251-86-0","floral waxy green sweet pear apple, floral, waxy and green with sweet pear nuances"
"145-39-1","musk ketone sweet powdery fatty"
"6290-37-5","sweet honey floral waxy woody sweaty green banana pineapple, sweet, honey, floral, waxy with woody and sweaty nuances"
"68916-62-1","fresh citrus citronella floral ionones"
"122-84-9","sweet fruity creamy spicy green anisic balsamic licorice fennel, sweet, fruity spicy, with anisic balsamic nuances"
