"CAS","odor_goodscents"
"928-94-9","green cortex leafy green bean nasturtium herbal soapy aldehydic narcissus phenolic, impacting fresh vegetative, slightly fatty with a green bean note, witch hazel and fusel alcoholic with a whiskey nuance"
"5182-36-5","fresh citrus gardenia green natural"
"35926-04-6","green fruity rum"
"65405-76-7","sweet green fruity concord grape jasmin orangeflower, deep sweet ripe fruity, concord grape skin with a jasmine and lilac floral note and a naphthyl-like nuance"
"53398-83-7","green fruity apricot ripe banana cortex orchid fermented, green, ripe fruity with apple and fermented banana notes and a fatty nuance, becoming green grassy on dryout"
"68133-75-5","fresh balsam green"
"53398-78-0","fruity green rum"
"68698-58-8","green violet"
"111-12-6","green leafy waxy violet cucumber, green, vegetative, fruity, fatty, waxy, cucumber, melon and violet leaf-like with floral nuances"
"123-94-4","mild fatty waxy"
"53956-04-0","bland"
"53398-86-0","green natural cognac herbal waxy clean"
"61444-38-0","green tomato leaf pear melon metallic fennel tropical"
"68133-78-8","green mossy rum honey"
"134-96-3","mild plastic woody tonka sweet"
"112-44-7","waxy soapy floral aldehydic citrus green fatty fresh laundry, intensely soapy, aldehydic waxy and slightly effervescent orange citrus-like with a watermelon, pineapple and cilantro background"
"53398-80-4","green fruity apple pear banana unripe banana tropical pulpy rhubarb, green, fruity apple and pear pulp with creamy and powdery nuances"
"33467-74-2","green pear apple fresh fruity waxy leafy, green, fruity, apple and pear with a sweet, leafy nuance"
"68133-77-7","green woody floral"
"56922-74-8","green fruity apple banana pineapple cognac, green, estry, fruity, apple, green banana and pineapple with slight cognac and winey nuances"
"35852-46-1","green fruity apple pear kiwi unripe banana tropical, heavy green with an estry fresh fruity nuance of apple, pear, grape, banana and kiwi"
"68698-59-9","green waxy apple pear banana grape, green, fresh waxy apple, pear and banana-like with nuances of viney fusel grape and vegetables"
"10039-39-1","sweet floral fruity"
"19089-92-0","sweet caramel green walnut oily radish, sweet, fruity green with apple and pear characters. it has vegetative nuances of celery and radish. a slight tropical note of pineapple"
"3488-00-4","cypress cuminic acetate fruity balsam"
"29896-45-5","fresh green fatty foliage woody"
"1119-06-8","dank foliage mallow leaves green"
"7289-40-9","wild hyacinth foliage green"
"10032-13-0","sweet green fruity apple unripe fruit apple skin strawberry, sweet green fruity apple pear tropical apple skin waxy, sweet, fruity, green, apple-like with fresh juicy skin notes"
"10519-12-7","sandalwood woody dry oily floral"
"66912-24-1","floral herbal fatty irone"
"67634-07-5","fresh green leafy clean herbal chrysanthemum"
"6561-39-3","brandy green vegetable fruity"
"151-10-0","acid fruity nutmeg neroli, sweet, cooling, medicinal, root beer-like"
"5421-17-0","sweet green waxy fruity rose wine foliage, sweet, green, waxy, floral and fruity with a slight powdery, honey nuance"
"102-76-1","mild clean tropical fruity, clean, creamy and slightly acidic"
"23811-08-7","spicy peppery woody"
"6753-98-6","woody"
"551-08-6","herbal lovage celery, celery, green, vegetable, lovage-like with a herbal note"
"10402-52-5","sweet hyacinth lilac green earthy"
"499-75-2","spice woody camphor thymol, spicy, cooling, thymol-like, herbal and camphoreous with smoky nuances"
"26266-77-3","mild woody"
"1333-89-7","mild woody"
"39252-03-4","sweet waxy metallic fruity peach, sweet, waxy, metallic, slightly fruity with bready and caramellic nuances"
"622-62-8","mild hawthorn phenolic plastic nutty"
"150-76-5","phenolic"
"3687-48-7","fresh fungal fruity genuine mushroom earthy violet melon humus"
"5077-67-8","sweet coffee musty grain malt butterscotch, sweet, brown, coffee, musty, grain- and pyrazine-like with malt and butterscotch nuances"
"7779-94-4","delicate green floral lily muguet"
"78649-62-4","jasmone green fungus"
"67923-85-7","fresh sweet woody hydroxycitronellal milky"
"25485-88-5","floral balsam sweet green"
"67801-64-3","spice woody floral grocery store"
"3583-00-4","fresh green herbal camphor woody"
"499-54-7","maple syrup brown sugar"
"404-86-4","mild warm herbal"
"1577-18-0","powerful fruity honey acid, cheesy, green, dairy-like with a waxy fruity nuance"
"589-66-2","fruity dry tropical rummy ripe green pear (caramellic is the long drydown), woody, fruity, brown, ripe and alcoholic-like with cognac and rum nuances"
"19009-56-4","powerful fresh dry citrus waxy watery"
"53053-51-3","sulfury cabbage fruity pineapple cheese"
"30897-75-7","woody pine linseed"
"7367-81-9","hairy costus sweet fruity pear oily waxy violet, fresh green, fruity, sweet, melon with a violet leaf-like nuance"
"84434-18-4","fresh woody citrus oily natural cedar grapefruit"
"10599-70-9","sweet musty nutty earthy cocoa corn leather, musty, nutmeat, powdery, slight roasted"
"1193-79-9","strong musty nutty hay coconut coumarin milky, sweet, musty, nutty with a caramellic nuance"
"59191-78-5","musty herbal sweet earthy"
"7493-69-8","nut fruit peach-pit cherry-pit ethereal"
"496-77-5","sweet pungent buttery nut"
"6728-31-0","oily fatty green dairy milky creamy"
"68084-03-7","fermented coffee yeast dark rye bread"
"36431-72-8","tea herbal green wet tobacco leaf metallic woody spicy, woody, cooling, minty and camphoreous, with a fresh green herbal nuance"
"673-22-3","vanillin like"
"4455-13-4","sulfurous green fruity tropical"
"76649-26-8","sweet waxy fresh green melon fruity pear cucumber melon"
"589-98-0","earthy mushroom herbal melon citrus woody spicy minty, earthy, mushroom, dairy, musty, creamy, waxy with a slight fermented green minty nuance"
"18829-56-6","fatty green cucumber aldehydic citrus, green, cucumber, aldehydic, fatty with a citrus nuance"
"37172-53-5","green jasmin floral fresh oily herbal"
"26446-31-1","fresh peach coconut oily"
"616-25-1","ethereal horseradish green radish chrysanthemum vegetable tropical fruity, pungent, horseradish-like, green vegetable and tropical fruity nuances"
"26446-32-2","fresh peach fruity coconut oily"
"4312-99-6","herbal mushroom earthy musty dirty, intense earthy, metallic, mushroom-like with vegetative nuances of cabbage and broccoli. it has minor savory notes of fish and chicken"
"3581-91-7","roasted nutty fishy green boiled shrimp, fishy, amine and pyridine-like with shrimp and savory nuances"
"31499-72-6","woody floral berry orris powdery violet raspberry fruity, woody, floral, berry, fruity with orris powdery undernotes"
"14309-57-0","fruity berry fatty oily ketonic weedy spicy licorice"
"80-57-9","camphor menthol celery"
"50306-18-8","green marine mushroom"
"25152-84-5","oily cucumber melon citrus pumpkin nut meat, fatty, chicken, fried, citrus, chicken fat, coriander and brothy"
"93-60-7","warm herbal tobacco"
"6378-65-0","herbal fresh cut grass vegetable fruity, green, sweet, waxy, fruity with tropical and berry notes"
"78-83-1","ethereal winey cortex"
"18829-55-5","pungent green vegetable fresh fatty, intense green, fatty, oily, with fruity overtones"
"6191-71-5","fresh oily fatty creamy vegetable dairy green grassy"
"80118-06-5","natural fruity floral herbal chamomile"
"105657-89-4","shrimp"
"41816-03-9","fresh woody spicy floral fruity rhubarb zesty"
"31704-80-0","green vegetable fruity fatty watermelon cucumber cyclamen floral, green, vegetable, fruity with fatty nuances"
"99-72-9","floral green sweet woody herbal powdery, floral, green, sweet, with woody herbal powdery nuances"
"7493-74-5","sweet fresh honey pineapple chamomile cocoa"
"10486-14-3","floral red rose honey waxy powdery geranium, floral, honey, sweet powdery, with green nuances"
"65405-70-1","fresh aldehydic citrus orange mandarin tangerine green fatty"
"2217-33-6","fruity green sweet musty tropical apricot pineapple, creamy, fruity green, with sweet musty tropical nuances"
"109-43-3","faint fruity oily"
"1072-83-9","musty nut skin maraschino cherry coumarinic licorice walnut bready, musty, nutty-like with a coumarin nuance"
"96-48-0","creamy oily fatty caramel, creamy, oily with fatty nuances"
"2785-89-9","spicy smoky bacon phenolic clove, spicy and clove-like with medicinal, woody and sweet vanilla nuances"
"625-60-5","sulfury fruity onion garlic meaty coffee, sulfuraceous, fruity, onion / garlic with meaty nuances"
"623-19-8","sweet fruity green banana oily coffee spicy"
"42436-07-7","green rose honey waxy sweet pea tropical kiwi beany, green, floral, vegetable, tropical and melon-like nuances"
"1438-94-4","plastic green waxy fruity coffee vegetable, vegetative, careal, bready, radish, mushroom and potato nuances"
"3549-23-3","dairy buttermilk leafy creamy green waxy fatty hyacinth melon rind rubbery"
"4630-82-4","fruity berry estery pineapple milk, sweet, cooling, minty and fruity"
"51755-66-9","sulfurous metallic green leafy vegetable, sulfurous, metallic and pungent with a slight spicy, green leafy, wasabi-like and vegetative note with and earthy nuance"
"1759-28-0","musty nutty root vegetable cocoa, diffusive, musty, nutty, root vegetable-like"
"1669-44-9","earthy spicy herbal sweet mushroom hay blueberry, earthy, oily, ketonic, sweet, with hay and mushroom nuances"
"105-43-1","animal sharp acidic cheesy green fruity sweaty, animalic, sharp acidic cheesey, green with a fruity sweaty nuance"
"1576-87-0","pungent green fruity apple orange tomato, pungent, green, fruity apple-like"
"3777-69-3","fruity green earthy beany vegetable metallic, fruity, green, earthy beany with vegetable like nuances"
"7756-96-9","petitgrain plum sweet grape fruity wine floral berry powdery, sweet, grape-like and fruity with a winey floral berry nuance"
"90-02-8","medical spicy cinnamon wintergreen cooling, medicinal, spicy cinnamon-wintergreen like cooling note"
"97-87-0","sweet fruity green tropical apple banana, sweet, tuti frutti, green, melon, banana, citrus with a alight cheesey nuance"
"67633-96-9","natural floral absolute violet green leaf waxy apple"
"65504-97-4","sweet nutty"
"59646-18-3","sweet nutty"
"79-42-5","meaty sulfurous roasted, sulfury, meaty savory, brown with roasted brown nuances"
"35044-59-8","fresh natural herbal damascon rose apple woody"
"67845-30-1","fresh grassy oily green spicy"
"28664-35-9","extremely sweet strong caramel maple burnt sugar coffee"
"34451-19-9","sweet diffusive fruity fermented mushroom milky creamy"
"5292-21-7","sharp acetic fatty cheese musty powdery honey caramel, sharp acidic, fatty cheesy, musty, powdery, honey and caramellic"
"38285-49-3","floral jasmin jasmone parsley jasmin absolute"
"591-12-8","sweet solvent nutty tonka coumarin tobacco, sweet, solvent-like, oily, coconut, nutty with coumarin, tobacco nuances"
"470-67-7","cooling pine minty camphor terpene green, minty, cooling piney, camphoraceous, eucalyptol-like"
"40527-42-2","mild floral sweet spicy meadow sweet"
"6222-35-1","sweet fruity banana green waxy, sweet, fruity, banana with green waxy nuances"
"611-13-2","fruity mushroom fungus tobacco sweet"
"623-70-1","pungent chemical diffusive sweet alliaceous caramel rum, pungent, chemical and diffusive, with sweet alliaceous and caramellic rum-like nuances"
"71-36-3","fusel oil sweet balsam whiskey"
"27538-09-6","sweet caramel bready maple brown sugar burnt, sweet, caramellic, bready, maple, brown sugar with burnt undernotes"
"1117-55-1","fruity green waxy berry apple ester, fruity, green, waxy, berry, apple and estery"
"3301-90-4","coconut oily green earthy"
"120-24-1","sweet spice clove cinnamon floral honey, sweet, spice, clove and cinnamon, floral and honey"
"1188-02-9","waxy green cheese sweaty butter milk, waxy, green, cheesy and sweaty"
"628-99-9","waxy green creamy citrus orange cheese fruity, waxy, green, creamy, citrus orange, cheesy with slight fruity undernotes"
"109-15-9","oily green waxy soapy clean fruity creamy, waxy, soapy, aldehydic, green, earthy, creamy"
"24817-51-4","floral green sweet tropical waxy rose"
"106-36-5","sharp chemical pungent sweet fruity pineapple winey, sharp, chemical, pungent with sweet fruity lift notes"
"3025-30-7","green waxy pear apple sweet fruity tropical, green, waxy, pear, vegetative, tropical and fruity"
"7367-88-6","green aldehydic fatty watercress herbal waxy unripe melon metallic, green, apple-pear with fruity and waxy nuances"
"928-91-6","green cooked vegetable tomato cooked turnup brothy gassy, green, herbal, musty, tomato, with metallic and vegetable nuances"
"1125-21-9","musty woody sweet tea tobacco leaf, musty, woody, sweet, tea, citrus lemon with si. brown nuances"
"84788-08-9","fatty melon green pear, fatty, melon, green, pear with fresh vegetable nuances"
"109-19-3","apple pear fruit sweet pineapple green peach, fruity, sweet, pineapple, pungent, green, apple and peach nuances"
"2721-22-4","waxy creamy buttery oily fatty cheesy milky dairy, waxy creamy oil fatty sweet milky and dairy"
"68603-22-5","fresh pencil cedar red cedar woody dry"
"593-08-8","fatty waxy dairy milky coconut nutty herbal earthy, fatty, waxy, mushroom, coconut and earthy with a mild chicken fat nuance"
"110-40-7","mild melon fruity quince wine"
"39212-23-2","tonka coumarin coconut toasted nutty celery burnt, coumarinic, coconut, iactonic, woody, maple and lovage with a slightly toasted, nutty nuance"
"112-80-1","faint fatty waxy lard fried, oily, waxy with lard and tallow notes. it has a fried savory nuance"
"7732-18-5","odorless"
"8050-15-5","balsamic woody amber peppery"
"67845-42-5","fresh citrus weedy grassy sharp woody"
"128-37-0","mild phenolic camphor"
"89-78-1","peppermint cool woody"
"157501-13-8","sweet rose waxy green citrus floral woody"
"34619-12-0","sulfurous onion"
"107715-18-4","new car woody clary vetiver"
"105-87-3","floral rose lavender green waxy"
"58461-27-1","delicate farnesol-like"
"63449-64-9","green leafy herbal"
"464-49-3","camphor minty phenolic herbal woody, camphoreous, medicinal, mentholic, with a cooling green nuance"
"61-90-5","odorless"
"18479-57-7","fresh sweet citrus lime floral lily"
"443-79-8","odorless"
"2216-51-5","peppermint cooling mentholic minty"
"60047-17-8","musty camphor fenchyl alcohol"
"134769-33-8","sweet tangerine aldehydic fresh watery"
"126-64-7","floral bergamot genet herbal tuberose tropical lily plum ylang grape"
"78-36-4","bergamot fruity banana berry, floral, fruity, sweet, blueberry, pineapple-like and citrus with a slight spice nuance"
"115-99-1","citrus herbal bergamot lavender soapy fatty green woody"
"7779-23-9","green warm fruity animal pear pineapple"
"60763-44-2","linalool"
"7143-69-3","rose sweet honey sick neroli rose"
"10471-96-2","fruity lavender apricot citrus"
"1118-27-0","citrus bergamot lavender peach apricot sage"
"465-24-7","strong moss woody"
"42370-07-0","camphor herbal minty woody apple"
"5137-52-0","balsam chocolate animal tobacco"
"502-65-8","balsam oriental"
"67801-44-9","fresh floral grape oily fatty"
"184900-07-0","floral jasmin waxy, sweet, spicy, fruity with a cinnamon nuance"
"101-85-9","floral jasmin waxy, sweet, spicy, fruity with a cinnamon nuance"
"73970-40-8","pyrazine green weedy woody vetiver"
"73970-38-4","pyrazine green weedy woody vetiver"
"68738-94-3","fresh lily sweet melon floral allo-ocimenol dry green"
"68738-96-5","fresh lily sweet melon floral allo-ocimenol dry green"
"97-67-6","odorless"
"140-25-0","light fatty waxy soapy"
"69-65-8","odorless"
"120-14-9","sweet woody vanilla, sweet, creamy, vanillin, powdery, herbal with a slight phenolic nuance"
"51154-96-2","sweet coconut meat lactonic creamy milky waxy, sweet, coconut meat, lactonic, creamy, milky and waxy"
"120-45-6","fresh sweet floral rose gardenia green weedy, sweet, fruity diffusive, with green, tropical and citrus nuances"
"536-50-5","sweet hawthorn floral nutty powdery"
"2497-18-9","sweet privet green fresh apple skin banana peel waxy apple, sweet leafy green with a fresh, fruity, apple nuance"
"53338-05-9","fresh lavender sweet herbal amber"
"536-59-4","green cumin spicy aromatic woody cardamom floral waxy violet, sweet , woody, aromatic spicy cardamom and green cumin like with dried orange peel and green waxy floral nuances"
"491-09-8","sharp minty phenolic"
"61931-81-5","green leafy sweet melon waxy violet leaf tropical fruity, green leafy, sweet with melon and vegetable nuances"
"529-01-1","sweet herbal fruity"
"15111-96-3","fruity dried fruit phenolic green geranium woody spicy herbal floral"
"499-70-7","woody minty spearmint cooling green"
"491-04-3","herbal"
"586-82-3","dry woody musty"
"138-87-4","pungent earthy woody"
"7764-50-3","warm powerful herbal spearmint, cooling, minty, woody, terpy, herbal, hay, rye bread and camphoreous"
"67707-75-9","fruity green apple wine yeast floral"
"62079-29-2","animal indole ethyl saferanate cistus woody"
"59557-05-0","minty"
"90397-38-9","fruity clean sweet pear oily jasmin natural"
"134-09-8","grape menthol"
"89-46-3","odorless"
"118-56-9","mild menthol"
"89-47-4","mild sweet mentholic fruity valerian"
"40789-98-8","sulfurous onion roasted gassy meaty, meaty, roasted beef, sulfurous, fried onion, with nuances of coffee and chocolate"
"100-66-3","phenolic gasoline ethereal anise"
"59021-02-2","roasted in sugar syrup meaty"
"7392-19-0","fresh camphor herbal rosemary, sweet, floral, citrus with woody, cooling, minty and camphoreous nuances"
"63458-81-1","grapefruit green pepper"
"23495-12-7","resin fruity myrrh opoponax lavender hay"
"63458-80-0","green fruity grapefruit mint leafy"
"103-60-6","sweet fruity tropical rose honey floral waxy, fruity, sweet, with green apple and powdery fruit blossom notes"
"67633-97-0","sulfurous metallic roasted onion horseradish potato, intense sulfurous, alliaceous and catty. it has nutty hazelnut note with savory roasted meaty nuances. it has faint nuances of tropical fruits and grapefruit"
"64275-73-6","green melon watery watermelon earthy mushroom violet leaf fishy soapy, green, melon, mushroom, soapy with earthy nuances"
"2277-19-2","green cucumber melon cantaloupe honeydew waxy vegetable orris violet leaf, green cucumber and melon with a woody orris-type nuance"
"28069-72-9","green cucumber oily violet leafy, green leafy with a mild fatty and oxidized nutty nuance"
"67674-36-6","green cucumber fresh oily painty"
"66427-22-3","grapefruit buchu oily mint"
"557-48-2","green fatty dry cucumber violet leaf, green, cucumber, melon, fatty and vegetative"
"66427-21-2","grapefruit vetiver"
"59-51-8","mild sulfurous acidic"
"64988-06-3","green spicy floral fruity tea rose"
"24680-50-0","spicy floral sweet cinnamon cherry vanilla"
"531-59-9","balsam tonka sweet"
"25680-58-4","raw potato earthy bell pepper nutty"
"110-39-4","fresh waxy fruity green oily earthy creamy natural jasmin, sweet, fruity, oily-waxy, with a green creamy nuance"
"100-09-4","faint putrid sweet cadaverous"
"65405-67-6","spicy cinnamon floral"
"2847-30-5","roasted almond hazelnut peanut"
"103-13-9","caramel fruity buttery"
"82297-64-1","dry sweet powdery cherry fruity heliotrope almond anisic vanilla, sweet, powdery, cherry, vanilla, coumarin, heliotropine"
"104-27-8","dry sweet powdery cherry fruity heliotrope almond anisic vanilla, sweet, powdery, cherry, vanilla, coumarin, heliotropine"
"14542-13-3","cereal bready caramellic"
"79-20-9","ether sweet fruity, etherial and solvent-like, estry, fruity, winey, cognac and rum"
"107898-54-4","woody sandalwood herbal tropical"
"7149-29-3","powerful fruity ether"
"121-98-2","herbal anise sweet"
"100-84-5","narcissus"
"578-58-5","sweet nutty floral earthy walnut, naphthyl, camphoreous, phenolic and woody with a salicylate nuance"
"1875-89-4","floral rose jasmin muguet lilac woody"
"95-21-6","tobacco burnt phenolic meaty powdery capers"
"1405-86-3","mild spicy"
"3460-44-4","sweet fruity berry juicy earthy floral jasmin, sweet, fruity, berry-like with a juicy fruit and bubble gum character and a tropical fruity pulpy and over ripe fruit nectar like nuance"
"76-09-5","woody earthy patchouli warm bread"
"7775-39-5","fruity tropical jasmin green mango"
"7775-38-4","green floral woody mimosa gardenia"
"644-08-6","floral spicy wintergreen anise waxy mint, floral, spicy, wintergreen, estragole and waxy with cooling, minty nuances"
"1878-18-8","sulfurous meaty bloody"
"2084-18-6","repulsive beefy meaty, sulfurous, savory burnt rubber, roasted chicken and pork meaty with nuances of roasted coffee, cultured cheeses and roasted cashew nuts."
"556-82-1","fruity green lavender, sweet, fruity, alcoholic with a green nuance"
"90-05-1","phenolic smoke spice vanilla woody, phenolic, smoky, spicy, medicinal, vanilla and savory meaty with a woody nuance"
"2445-77-4","herbal fruity earthy cheese apple green, fruity, sweaty, cheesy, slightly green, with a heavy apple skin, winey and cognac nuance"
"1504-75-2","spicy cinnamon"
"1504-55-8","sweet balsam floral oriental styrax"
"469-61-4","woody cedar sweet fresh"
"623-43-8","sharp green fruity"
"97-64-3","sharp tart fruity buttery butterscotch, sweet, fruity, acidic, etherial with a brown nuance"
"65813-53-8","fruity floral mango pineapple papaya mango tropical"
"103-58-2","fruity tropical apricot plum balsamic jammy honey bready osmanthus dried fruit, sweet rich fruity, juicy fruit, honey, tropical fruity with fermented sugar, and jammy osmanthus like nuances"
"106-23-0","sweet dry floral herbal waxy aldehydic citrus, sweet, floral rosy waxy and citrus green"
"9004-67-5","odorless"
"620-02-0","spice caramel maple, sweet, caramellic, bready, brown, coffee-like"
"108576-21-2","spice cinnamon woody herbal, spicy, cassia, cinnamon and woody with herbal, medicinal nuances"
"874-66-8","spice cinnamon woody herbal, spicy, cassia, cinnamon and woody with herbal, medicinal nuances"
"99-87-6","fresh citrus terpene woody spice"
"2396-77-2","fatty green fruity pineapple earthy"
"99-76-3","odorless"
"127-43-5","orris woody powdery floral violet tropical tobacco creamy"
"7784-98-7","musk patchouli oakmoss"
"606-45-1","herbal floral hyacinth cananga fruity blackcurrant"
"2412-80-8","fruity sweet banana pineapple cheese, fruity, sweet, banana, pineapple, with cheese-like nuances"
"124-10-7","fatty waxy petal"
"10032-05-0","green privet fruity tropical orange, green, oily, fatty and waxy with a fruity nuance"
"1731-84-6","sweet fruity pear waxy tropical wine, sweet, fruity, pear-like, waxy, winey, with a slight tropical nuance"
"7786-29-0","floral rose lily muguet"
"7493-58-5","sweet fruity buttery creamy fatty, sweet, fruity, buttery, creamy, with a brown fatty nuance"
"55066-56-3","tobacco animal sweet herbal"
"108-10-1","sharp solvent green herbal fruity dairy spice, sharp solvent-like with green, herbal, fruity and dairy nuances"
"110458-85-0","fresh woody ozone clean outdoor"
"1123-85-9","green spicy hyacinth balsam lilac honeysuckle"
"2186-92-7","mild floral hawthorn jasmin lilac elderflower"
"1901-26-4","fruity berry camphor"
"42968-14-9","fruity berry camphor"
"925-78-0","fresh sweet jasmin spicy leaf herbal fruity"
"5452-07-3","fruity strawberry raspberry plum"
"10031-71-7","floral green geranium honey powdery papaya tropical raisin plum, floral, green, fruity and powdery with a honey nuance"
"40654-82-8","sweet floral earthy musty"
"2439-44-3","green fruity"
"13477-62-8","rose geranium green herbal metallic"
"2046-17-5","sweet fruit honey floral"
"5349-62-2","sweet woody fruity spice burnt sugar"
"103-25-3","honey fruity wine balsam floral"
"3268-49-3","musty potato tomato earthy vegetable creamy, vegetable oil. creamy tomato, potato skin and french fry, yeasty, bready, limburger cheese with a savory meaty brothy nuance"
"10522-18-6","waxy fruity green floral violet, waxy, fruity, meaty and fatty with a milky nuance"
"97-61-0","sour cheese"
"142-47-2","bland peptone"
"588-67-0","floral rose"
"478695-70-4","powdery creamy warm musk fresh fruity apple"
"63449-68-3","floral neroli grape, sweet concord grape anthranilate-like with a slight candy syrupy fruity berry aftertaste and slight floral and winey nuances"
"36306-87-3","woody old wood amber tobacco hot herbal"
"999-40-6","green waxy oily fatty sweet leaf orange, green, waxy, oily and fatty"
"2142-94-1","green rose geranium herbal fruity tea, green, metallic, sweet, fruity, floral, citrus and tropical"
"105-91-9","fruity floral green jammy berry, fruity geranium green neroli grape berry jam waxy, fruity, floral, sweet, green, tutti-frutti, with a powdery nuance"
"3915-83-1","sweaty floral rose bergamot citrus fruity, sour sweaty with floral rosy under notes, a bergamot citrus nuance and fruity notes of blueberry, cranberry, apple and grape"
"77923-74-1","tropical autumn fresh ozone orris woody earthy"
"7779-54-6","fruity floral waxy mignonette"
"18096-62-3","animal indole earthy jasmin"
"6413-10-1","sweet fruity apple green tropical plum woody"
"2444-46-4","bland odorless"
"7786-48-3","sweet rose mushroom floral cognac"
"7786-47-2","fruity apple hazelnut citrus"
"65405-68-7","fruity herbal spicy"
"5132-75-2","fruity fatty, fruity"
"7425-14-1","fruity"
"122-45-2","rooty orange basil bois de rose earthy honey"
"142-60-9","sweet fruity mushroom floral raspberry jammy green, sweet, fruity, woody and floral with a jammy and green nuance"
"7786-58-5","mild warm floral rose honey apple pineapple"
"41496-43-9","fresh cyclamen orange dry sweet aldehydic amber woody costus, sweet, floral, fruity, citrus with a slight green powdery melon afternote"
"141-12-8","floral rose soapy citrus dewy pear, floral, rosy, sweet, soapy, citrus, grapefruit and fruity with a tropical nuance"
"7664-38-2","bland"
"93-08-3","sweet neroli orange blossom neroli powdery"
"591-80-0","cheese parmesan romano ricotta"
"7149-32-8","honey rose musty mushroom"
"81786-73-4","woody floral pine balsam violet methyl ionone"
"42078-65-9","deep sweet herbal wine"
"65-85-0","faint balsam urine"
"60512-85-8","balsam fruity tropical cinnamyl berry strawberry peach"
